{
  "lockStatusAuthority": "lock.json",
  "manifestVersion": "1.0",
  "suiteVersion": "PINN-CLOSED-LOOP-CORE-1.0",
  "schemaVersion": "1.0",
  "conceptualCaseCount": 15,
  "executableScenarioCount": 18,
  "categories": [
    "ANALYTIC",
    "STRUCTURAL",
    "PROVENANCE",
    "BITWISE_TRAINING"
  ],
  "testModes": [
    "WORKFLOW_E2E",
    "VALIDATOR_COMPONENT",
    "TRAINING_E2E"
  ],
  "expectedVerdictRegistration": {
    "declaredBeforeFirstExecution": true,
    "resultIndependent": true,
    "lockBindingField": "adversarialManifestSha256"
  },
  "cases": [
    {
      "caseId": "G1",
      "conceptualIntent": "Accept a correct deterministic implementation over all five preregistered seeds.",
      "subcases": [
        {
          "subcaseId": "G1",
          "testMode": "TRAINING_E2E",
          "category": "BITWISE_TRAINING",
          "construction": {
            "description": "Correct equation, boundary operator, float64 CPU executor, protocol and five preregistered seeds.",
            "frozenParameters": {
              "seeds": [
                20260904,
                20260905,
                20260906,
                20260907,
                20260908
              ],
              "device": "cpu",
              "dtype": "float64"
            }
          },
          "trainingApplicable": true,
          "expected": {
            "gateStatus": {
              "G1": "PASS",
              "G2": "PASS",
              "G3": "PASS",
              "G4": "PASS",
              "G5": "PASS",
              "G6": "PASS",
              "G7": "PASS"
            },
            "workflowStatus": "ACCEPTED",
            "claimStatus": {
              "C0": "SUPPORTED",
              "C1": "SUPPORTED",
              "C2": "SUPPORTED",
              "C3": "SUPPORTED"
            },
            "failureRecord": {
              "required": false,
              "taxonomy": null,
              "requirements": []
            },
            "stopTheLine": false
          }
        }
      ]
    },
    {
      "caseId": "B1",
      "conceptualIntent": "Reject a sign-flipped PDE both at implementation verification and at isolated prediction validation.",
      "subcases": [
        {
          "subcaseId": "B1a",
          "testMode": "VALIDATOR_COMPONENT",
          "category": "ANALYTIC",
          "construction": {
            "description": "Apply Gate 3 manufactured-solution verification to the sign-flipped residual.",
            "frozenParameters": {
              "residualLinf": 19.739208802178716,
              "gateUnderTest": "G3"
            }
          },
          "trainingApplicable": false,
          "expected": {
            "gateStatus": {
              "G3": "FAIL"
            },
            "workflowStatus": "NOT_APPLICABLE",
            "claimStatus": {
              "C2": "NOT_APPLICABLE"
            },
            "componentDecision": "REJECT_IMPLEMENTATION",
            "failureRecord": {
              "required": true,
              "taxonomy": "IMPLEMENTATION",
              "requirements": [
                "record sign-flipped residual evidence"
              ]
            },
            "stopTheLine": false
          }
        },
        {
          "subcaseId": "B1b",
          "testMode": "VALIDATOR_COMPONENT",
          "category": "ANALYTIC",
          "construction": {
            "description": "Validate the closed-form wrong predictor -sin(pi*x) without pretending Gate 3 was passed or a workflow reached Gate 5.",
            "frozenParameters": {
              "relativeL2": 2.0,
              "gateUnderTest": "G5"
            }
          },
          "trainingApplicable": false,
          "expected": {
            "gateStatus": {
              "G5": "FAIL"
            },
            "workflowStatus": "NOT_APPLICABLE",
            "claimStatus": {
              "C2": "NOT_APPLICABLE"
            },
            "componentDecision": "REFUTE_PREDICTION",
            "failureRecord": {
              "required": true,
              "taxonomy": "VALIDATION",
              "requirements": [
                "record AC-1 failure",
                "do not fabricate upstream Gate states"
              ]
            },
            "stopTheLine": false
          }
        }
      ]
    },
    {
      "caseId": "B2",
      "conceptualIntent": "Reject a boundary implementation that differs from the frozen specification.",
      "subcases": [
        {
          "subcaseId": "B2",
          "testMode": "VALIDATOR_COMPONENT",
          "category": "STRUCTURAL",
          "construction": {
            "description": "Implementation uses u(1)=1 while the spec requires u(1)=0.",
            "frozenParameters": {
              "implementedRightBoundary": 1.0,
              "specifiedRightBoundary": 0.0
            }
          },
          "trainingApplicable": false,
          "expected": {
            "gateStatus": {
              "G3": "FAIL"
            },
            "workflowStatus": "NOT_APPLICABLE",
            "claimStatus": {
              "C2": "NOT_APPLICABLE"
            },
            "componentDecision": "REJECT_CODE_CONFIG_MISMATCH",
            "failureRecord": {
              "required": true,
              "taxonomy": "IMPLEMENTATION",
              "requirements": [
                "record boundary code/config mismatch"
              ]
            },
            "stopTheLine": false
          }
        }
      ]
    },
    {
      "caseId": "B3",
      "conceptualIntent": "Show that a PDE-satisfying predictor can still violate the boundary condition.",
      "subcases": [
        {
          "subcaseId": "B3",
          "testMode": "VALIDATOR_COMPONENT",
          "category": "ANALYTIC",
          "construction": {
            "description": "Closed-form predictor sin(pi*x)+0.3 has zero PDE residual and boundary error 0.3.",
            "frozenParameters": {
              "offset": 0.3,
              "boundaryError": 0.3,
              "relativeL2": 0.4242640687119285
            }
          },
          "trainingApplicable": false,
          "expected": {
            "gateStatus": {
              "G5": "FAIL"
            },
            "workflowStatus": "NOT_APPLICABLE",
            "claimStatus": {
              "C2": "NOT_APPLICABLE"
            },
            "componentDecision": "REJECT_AC_3",
            "failureRecord": {
              "required": true,
              "taxonomy": "LOSS_BALANCE",
              "requirements": [
                "record unweighted boundary component separately"
              ]
            },
            "stopTheLine": false
          }
        }
      ]
    },
    {
      "caseId": "B4",
      "conceptualIntent": "Reject a near-threshold sparse-collocation null-space mode.",
      "subcases": [
        {
          "subcaseId": "B4",
          "testMode": "VALIDATOR_COMPONENT",
          "category": "ANALYTIC",
          "construction": {
            "description": "Use sin(pi*x)+A*sin(4*pi*x) on collocation points {1/4,1/2,3/4}.",
            "frozenParameters": {
              "mode": 4,
              "amplitude": 0.002,
              "collocation": [
                0.25,
                0.5,
                0.75
              ],
              "relativeL2": 0.002,
              "normalisedResidual": 0.032
            }
          },
          "trainingApplicable": false,
          "expected": {
            "gateStatus": {
              "G5": "FAIL"
            },
            "workflowStatus": "NOT_APPLICABLE",
            "claimStatus": {
              "C2": "NOT_APPLICABLE"
            },
            "componentDecision": "REJECT_AC_1_AND_AC_4",
            "failureRecord": {
              "required": true,
              "taxonomy": "SAMPLING",
              "requirements": [
                "record AC-1 failure",
                "record AC-4 failure"
              ]
            },
            "stopTheLine": false
          }
        }
      ]
    },
    {
      "caseId": "B5",
      "conceptualIntent": "Reject an incorrect coordinate scaling before training.",
      "subcases": [
        {
          "subcaseId": "B5",
          "testMode": "VALIDATOR_COMPONENT",
          "category": "ANALYTIC",
          "construction": {
            "description": "Evaluate the manufactured solution with the second-derivative chain factor four omitted.",
            "frozenParameters": {
              "missingChainFactor": 4.0,
              "residualLinf": 29.608813203268074
            }
          },
          "trainingApplicable": false,
          "expected": {
            "gateStatus": {
              "G3": "FAIL"
            },
            "workflowStatus": "NOT_APPLICABLE",
            "claimStatus": {
              "C2": "NOT_APPLICABLE"
            },
            "componentDecision": "REJECT_SCALING",
            "failureRecord": {
              "required": true,
              "taxonomy": "SCALING",
              "requirements": [
                "record manufactured-solution residual"
              ]
            },
            "stopTheLine": false
          }
        }
      ]
    },
    {
      "caseId": "B6",
      "conceptualIntent": "Reject a large collocation-aliasing trap invisible on its training lattice.",
      "subcases": [
        {
          "subcaseId": "B6",
          "testMode": "VALIDATOR_COMPONENT",
          "category": "ANALYTIC",
          "construction": {
            "description": "Use sin(pi*x)+A*sin(5*pi*x) on collocation points i/5 for i=1..4.",
            "frozenParameters": {
              "mode": 5,
              "amplitude": 0.2,
              "collocation": [
                0.2,
                0.4,
                0.6,
                0.8
              ],
              "relativeL2": 0.2,
              "normalisedResidual": 5.0
            }
          },
          "trainingApplicable": false,
          "expected": {
            "gateStatus": {
              "G5": "FAIL"
            },